{
  "mcpServers": {},
  "packages": {
    "apt": [],
    "npm": []
  },
  "additionalMounts": [],
  "skills": ["lark-doc", "lark-drive", "lark-wiki", "lark-whiteboard", "lark-workflow-meeting-summary", "lark-workflow-standup-report"],
  "a2aSessionMode": "root-session",
  "resources": {
    "memoryMb": 1024,
    "cpus": 1,
    "pidsLimit": 512
  },
  "provider": "openai"
}
