{
  "$schema": "../../docs/schemas/container.schema.json",
  "mcpServers": {},
  "enterpriseGateway": {
    "baseUrl": "http://localhost:8088",
    "timeoutMs": 30000,
    "defaultHeaders": {
      "X-FrontLane-Source": "frontlane-lab-frontdesk"
    }
  },
  "packages": {
    "apt": [],
    "npm": []
  },
  "additionalMounts": [],
  "skills": "all",
  "provider": "litellm-proxy",
  "groupName": "FrontLane Lab Desk",
  "assistantName": "FrontLane Lab Desk",
  "memoryMode": "erp",
  "a2aSessionMode": "root-session",
  "agentGroupId": "ag-1781032794425-wz0jkd",
  "maxMessagesPerPrompt": 10,
  "idleExitMs": 120000,
  "progressiveDisclosure": false,
  "resources": {
    "memoryMb": 1024,
    "cpus": 0.5,
    "pidsLimit": 256
  }
}
