{
  "mcpServers": {},
  "packages": {
    "apt": [
      "python3",
      "python3-requests"
    ],
    "npm": []
  },
  "imageTag": "frontlane-agent-v2-aa698fd5:ag-1778662245-labopswk",
  "additionalMounts": [],
  "skills": [
    "analyze-result",
    "daily-report",
    "daily-tasks",
    "demo-fixed-qa",
    "experiment-archive",
    "experiment-card",
    "find-skills",
    "lab-db",
    "nano-pdf",
    "python",
    "semantic-route",
    "standard-demo",
    "task-planner"
  ],
  "provider": "openai",
  "a2aSessionMode": "root-session",
  "resources": {
    "memoryMb": 1024,
    "cpus": 1,
    "pidsLimit": 512
  }
}
